"Status","Start Time","Stop Time","Duration in ms","Parent Suite","Suite","Sub Suite","Test Class","Test Method","Name","Description"
"unknown","Mon Apr 10 02:27:59 GMT 2023","Mon Apr 10 02:28:01 GMT 2023","2359","WIDGET_DISPLAY_AND_MENUS","Open only the selected accordian section on click","","","","Open only the selected accordian section on click",""
"passed","Mon Apr 10 02:28:13 GMT 2023","Mon Apr 10 02:28:17 GMT 2023","4235","WIDGET_DISPLAY_AND_MENUS","Fill all the select fields displayed","","","","Fill all the select fields displayed",""
"passed","Mon Apr 10 02:26:25 GMT 2023","Mon Apr 10 02:26:28 GMT 2023","3432","ADD_DELETE_UPDATE_WEBTABLE_DATA","Upload a file and check file path","","","","Upload a file and check file path",""
"unknown","Mon Apr 10 02:28:41 GMT 2023","Mon Apr 10 02:28:43 GMT 2023","2118","WIDGET_INTERACTIONS_WITH_INPUT_FIELDS","Change input value by clicking on the slider bar","","","","Change input value by clicking on the slider bar",""
"passed","Mon Apr 10 02:26:13 GMT 2023","Mon Apr 10 02:26:18 GMT 2023","4124","ADD_DELETE_UPDATE_WEBTABLE_DATA","Edit the first entry in the web table","","","","Edit the first entry in the web table",""
"passed","Mon Apr 10 02:27:49 GMT 2023","Mon Apr 10 02:27:55 GMT 2023","5821","FILL_FORMS","Fill a complete form using external json data","","","","Fill a complete form using external json data",""
"unknown","Mon Apr 10 02:27:55 GMT 2023","Mon Apr 10 02:27:55 GMT 2023","1","FRAMES","Check multiple frames are displayed properly","","","","Check multiple frames are displayed properly",""
"passed","Mon Apr 10 02:26:45 GMT 2023","Mon Apr 10 02:26:48 GMT 2023","3419","ALERT_AND_POPUP_DISPLAY","Check different alerts popins are displayed","","","","Check different alerts popins are displayed",""
"passed","Mon Apr 10 02:26:28 GMT 2023","Mon Apr 10 02:26:31 GMT 2023","3246","ADD_DELETE_UPDATE_WEBTABLE_DATA","Download a file online","","","","Download a file online",""
"passed","Mon Apr 10 02:28:46 GMT 2023","Mon Apr 10 02:28:50 GMT 2023","3409","WIDGET_INTERACTIONS_WITH_INPUT_FIELDS","Click on ""Stop"" to stop the progress bar from filling","","","","Click on ""Stop"" to stop the progress bar from filling",""
"passed","Mon Apr 10 02:28:10 GMT 2023","Mon Apr 10 02:28:13 GMT 2023","3423","WIDGET_DISPLAY_AND_MENUS","Navigate using in-page menu and sub-menu contents on hover","","","","Navigate using in-page menu and sub-menu contents on hover",""
"passed","Mon Apr 10 02:28:31 GMT 2023","Mon Apr 10 02:28:34 GMT 2023","3511","WIDGET_INTERACTIONS_WITH_INPUT_FIELDS","Check suggestions when using autocomplete on input field","","","","Check suggestions when using autocomplete on input field",""
"unknown","Mon Apr 10 02:28:37 GMT 2023","Mon Apr 10 02:28:39 GMT 2023","2184","WIDGET_INTERACTIONS_WITH_INPUT_FIELDS","Checking a date via date picker using calendar module","","","","Checking a date via date picker using calendar module",""
"passed","Mon Apr 10 02:25:37 GMT 2023","Mon Apr 10 02:25:37 GMT 2023","31","API_CALLS","Search a pet in petstore API","","","","Search a pet in petstore API",""
"unknown","Mon Apr 10 02:28:34 GMT 2023","Mon Apr 10 02:28:37 GMT 2023","2284","WIDGET_INTERACTIONS_WITH_INPUT_FIELDS","Checking a date via date picker using input field","","","","Checking a date via date picker using input field",""
"passed","Mon Apr 10 02:28:50 GMT 2023","Mon Apr 10 02:28:54 GMT 2023","3742","WIDGET_INTERACTIONS_WITH_INPUT_FIELDS","The button ""Reset"" is visible after the progress bar is at 100%","","","","The button ""Reset"" is visible after the progress bar is at 100%",""
"unknown","Mon Apr 10 02:28:39 GMT 2023","Mon Apr 10 02:28:41 GMT 2023","2199","WIDGET_INTERACTIONS_WITH_INPUT_FIELDS","Change input value by moving the slider","","","","Change input value by moving the slider",""
"passed","Mon Apr 10 02:27:29 GMT 2023","Mon Apr 10 02:27:32 GMT 2023","3208","CLICK_ON_DIFFERENT_BUTTON_TYPES","Display radio button text when selected","","","","Display radio button text when selected",""
"passed","Mon Apr 10 02:26:09 GMT 2023","Mon Apr 10 02:26:13 GMT 2023","4030","ADD_DELETE_UPDATE_WEBTABLE_DATA","Add a new entry to web table","","","","Add a new entry to web table",""
"passed","Mon Apr 10 02:27:32 GMT 2023","Mon Apr 10 02:27:36 GMT 2023","3693","CLICK_ON_DIFFERENT_BUTTON_TYPES","Display button click when clicked on","","","","Display button click when clicked on",""
"passed","Mon Apr 10 02:25:37 GMT 2023","Mon Apr 10 02:25:40 GMT 2023","2804","ACCESS_LINKS","Redirection to a new page when clicking on link (tabs and windows)","","","","Redirection to a new page when clicking on link (tabs and windows)",""
"unknown","Mon Apr 10 02:27:55 GMT 2023","Mon Apr 10 02:27:55 GMT 2023","1","FRAMES","Check frames nested are displayed properly","","","","Check frames nested are displayed properly",""
"passed","Mon Apr 10 02:26:21 GMT 2023","Mon Apr 10 02:26:25 GMT 2023","3585","ADD_DELETE_UPDATE_WEBTABLE_DATA","Search Kierra entry in the web table","","","","Search Kierra entry in the web table",""
"passed","Mon Apr 10 02:27:18 GMT 2023","Mon Apr 10 02:27:23 GMT 2023","4606","CLICK_ON_DIFFERENT_BUTTON_TYPES","Display checkbox folders and sub-folders when checked","","","","Display checkbox folders and sub-folders when checked",""
"unknown","Mon Apr 10 02:28:07 GMT 2023","Mon Apr 10 02:28:10 GMT 2023","2206","WIDGET_DISPLAY_AND_MENUS","Navigate using in-page tab contents on click","","","","Navigate using in-page tab contents on click",""
"passed","Mon Apr 10 02:26:18 GMT 2023","Mon Apr 10 02:26:21 GMT 2023","3390","ADD_DELETE_UPDATE_WEBTABLE_DATA","Delete the third entry in the web table","","","","Delete the third entry in the web table",""
"passed","Mon Apr 10 02:26:55 GMT 2023","Mon Apr 10 02:27:03 GMT 2023","7927","BROWSER_WINDOWS_AND_TABS","Redirection to a new tab when clicking on ""New Tab"" button","","","","Redirection to a new tab when clicking on ""New Tab"" button",""
"passed","Mon Apr 10 02:26:01 GMT 2023","Mon Apr 10 02:26:05 GMT 2023","3476","ACCESS_LINKS","Check API response by clicking on links","","","","Check API response by clicking on links",""
"passed","Mon Apr 10 02:26:05 GMT 2023","Mon Apr 10 02:26:09 GMT 2023","4654","ACCESS_LINKS","Check broken links returns an error 500","","","","Check broken links returns an error 500",""
"passed","Mon Apr 10 02:28:43 GMT 2023","Mon Apr 10 02:28:46 GMT 2023","3465","WIDGET_INTERACTIONS_WITH_INPUT_FIELDS","Click on ""Start"" to fill up the progress bar","","","","Click on ""Start"" to fill up the progress bar",""
"passed","Mon Apr 10 02:26:52 GMT 2023","Mon Apr 10 02:26:55 GMT 2023","3404","ALERT_AND_POPUP_DISPLAY","Check different modals dialogs popin are displayed","","","","Check different modals dialogs popin are displayed",""
"passed","Mon Apr 10 02:27:11 GMT 2023","Mon Apr 10 02:27:18 GMT 2023","7340","BROWSER_WINDOWS_AND_TABS","Opening a new window with text when clicking on ""New Window Message"" button","","","","Opening a new window with text when clicking on ""New Window Message"" button",""
"passed","Mon Apr 10 02:25:37 GMT 2023","Mon Apr 10 02:25:37 GMT 2023","194","API_CALLS","Create a new pet in petstore API","","","","Create a new pet in petstore API",""
"skipped","Mon Apr 10 02:25:37 GMT 2023","Mon Apr 10 02:25:37 GMT 2023","2","CONTAINER-MYSQL","Retrieve version Mysql","","","","Retrieve version Mysql",""
"passed","Mon Apr 10 02:25:37 GMT 2023","Mon Apr 10 02:25:37 GMT 2023","64","API_CALLS","Rename a pet in petstore API","","","","Rename a pet in petstore API",""
"passed","Mon Apr 10 02:25:37 GMT 2023","Mon Apr 10 02:25:37 GMT 2023","374","API_CALLS","Delete a pet in petstore API","","","","Delete a pet in petstore API",""
"passed","Mon Apr 10 02:27:44 GMT 2023","Mon Apr 10 02:27:49 GMT 2023","4390","DRAG_AND_DROP","Drag and drop a draggable element into another","","","","Drag and drop a draggable element into another",""
"passed","Mon Apr 10 02:27:36 GMT 2023","Mon Apr 10 02:27:44 GMT 2023","8242","CLICK_ON_DIFFERENT_BUTTON_TYPES","Check dynamic elements change properties after 5 seconds","","","","Check dynamic elements change properties after 5 seconds",""
"skipped","Mon Apr 10 02:25:37 GMT 2023","Mon Apr 10 02:25:37 GMT 2023","1","CONTAINER-MSSQL","Retrieve version MSSQL","","","","Retrieve version MSSQL",""
"passed","Mon Apr 10 02:27:03 GMT 2023","Mon Apr 10 02:27:11 GMT 2023","7238","BROWSER_WINDOWS_AND_TABS","Redirection to a new window when clicking on ""New Window"" button","","","","Redirection to a new window when clicking on ""New Window"" button",""
"passed","Mon Apr 10 02:28:27 GMT 2023","Mon Apr 10 02:28:31 GMT 2023","3318","WIDGET_DISPLAY_AND_MENUS","Display information tooltips on hover for designated element","","","","Display information tooltips on hover for designated element",""
