"Status","Start Time","Stop Time","Duration in ms","Parent Suite","Suite","Sub Suite","Test Class","Test Method","Name","Description"
"unknown","Wed Nov 22 02:32:46 GMT 2023","Wed Nov 22 02:32:55 GMT 2023","8508","WIDGET_DISPLAY_AND_MENUS","Open only the selected accordian section on click","","","","Open only the selected accordian section on click",""
"unknown","Wed Nov 22 02:35:32 GMT 2023","Wed Nov 22 02:35:34 GMT 2023","2747","WIDGET_INTERACTIONS_WITH_INPUT_FIELDS","Checking a date via date picker using calendar module","","","","Checking a date via date picker using calendar module",""
"passed","Wed Nov 22 02:28:13 GMT 2023","Wed Nov 22 02:28:27 GMT 2023","13937","ADD_DELETE_UPDATE_WEBTABLE_DATA","Add a new entry to web table","","","","Add a new entry to web table",""
"passed","Wed Nov 22 02:33:29 GMT 2023","Wed Nov 22 02:33:39 GMT 2023","10107","WIDGET_DISPLAY_AND_MENUS","Navigate using in-page menu and sub-menu contents on hover","","","","Navigate using in-page menu and sub-menu contents on hover",""
"passed","Wed Nov 22 02:28:41 GMT 2023","Wed Nov 22 02:28:54 GMT 2023","12957","ADD_DELETE_UPDATE_WEBTABLE_DATA","Delete the third entry in the web table","","","","Delete the third entry in the web table",""
"passed","Wed Nov 22 02:35:41 GMT 2023","Wed Nov 22 02:35:46 GMT 2023","5074","WIDGET_INTERACTIONS_WITH_INPUT_FIELDS","Click on ""Start"" to fill up the progress bar","","","","Click on ""Start"" to fill up the progress bar",""
"passed","Wed Nov 22 02:26:24 GMT 2023","Wed Nov 22 02:26:28 GMT 2023","4000","ACCESS_LINKS","Redirection to a new page when clicking on link (tabs and windows)","","","","Redirection to a new page when clicking on link (tabs and windows)",""
"passed","Wed Nov 22 02:31:26 GMT 2023","Wed Nov 22 02:31:31 GMT 2023","5383","DRAG_AND_DROP","Drag and drop a draggable element into another","","","","Drag and drop a draggable element into another",""
"passed","Wed Nov 22 02:35:25 GMT 2023","Wed Nov 22 02:35:29 GMT 2023","3938","WIDGET_INTERACTIONS_WITH_INPUT_FIELDS","Check suggestions when using autocomplete on input field","","","","Check suggestions when using autocomplete on input field",""
"passed","Wed Nov 22 02:26:24 GMT 2023","Wed Nov 22 02:26:24 GMT 2023","89","API_CALLS","Delete a pet in petstore API","","","","Delete a pet in petstore API",""
"passed","Wed Nov 22 02:29:07 GMT 2023","Wed Nov 22 02:29:20 GMT 2023","12991","ADD_DELETE_UPDATE_WEBTABLE_DATA","Upload a file and check file path","","","","Upload a file and check file path",""
"passed","Wed Nov 22 02:35:46 GMT 2023","Wed Nov 22 02:35:50 GMT 2023","4024","WIDGET_INTERACTIONS_WITH_INPUT_FIELDS","Click on ""Stop"" to stop the progress bar from filling","","","","Click on ""Stop"" to stop the progress bar from filling",""
"passed","Wed Nov 22 02:29:20 GMT 2023","Wed Nov 22 02:29:24 GMT 2023","3453","ADD_DELETE_UPDATE_WEBTABLE_DATA","Download a file online","","","","Download a file online",""
"passed","Wed Nov 22 02:28:54 GMT 2023","Wed Nov 22 02:29:07 GMT 2023","13080","ADD_DELETE_UPDATE_WEBTABLE_DATA","Search Kierra entry in the web table","","","","Search Kierra entry in the web table",""
"passed","Wed Nov 22 02:28:27 GMT 2023","Wed Nov 22 02:28:41 GMT 2023","13719","ADD_DELETE_UPDATE_WEBTABLE_DATA","Edit the first entry in the web table","","","","Edit the first entry in the web table",""
"passed","Wed Nov 22 02:35:21 GMT 2023","Wed Nov 22 02:35:25 GMT 2023","4148","WIDGET_DISPLAY_AND_MENUS","Display information tooltips on hover for designated element","","","","Display information tooltips on hover for designated element",""
"passed","Wed Nov 22 02:30:15 GMT 2023","Wed Nov 22 02:30:23 GMT 2023","7372","BROWSER_WINDOWS_AND_TABS","Redirection to a new window when clicking on ""New Window"" button","","","","Redirection to a new window when clicking on ""New Window"" button",""
"passed","Wed Nov 22 02:31:02 GMT 2023","Wed Nov 22 02:31:08 GMT 2023","5700","CLICK_ON_DIFFERENT_BUTTON_TYPES","Display button click when clicked on","","","","Display button click when clicked on",""
"passed","Wed Nov 22 02:26:24 GMT 2023","Wed Nov 22 02:26:24 GMT 2023","157","API_CALLS","Rename a pet in petstore API","","","","Rename a pet in petstore API",""
"unknown","Wed Nov 22 02:32:07 GMT 2023","Wed Nov 22 02:32:07 GMT 2023","1","FRAMES","Check multiple frames are displayed properly","","","","Check multiple frames are displayed properly",""
"unknown","Wed Nov 22 02:32:07 GMT 2023","Wed Nov 22 02:32:07 GMT 2023","1","FRAMES","Check frames nested are displayed properly","","","","Check frames nested are displayed properly",""
"passed","Wed Nov 22 02:26:24 GMT 2023","Wed Nov 22 02:26:24 GMT 2023","90","API_CALLS","Create a new pet in petstore API","","","","Create a new pet in petstore API",""
"unknown","Wed Nov 22 02:35:34 GMT 2023","Wed Nov 22 02:35:37 GMT 2023","2777","WIDGET_INTERACTIONS_WITH_INPUT_FIELDS","Change input value by moving the slider","","","","Change input value by moving the slider",""
"skipped","Wed Nov 22 02:26:24 GMT 2023","Wed Nov 22 02:26:24 GMT 2023","1","CONTAINER-MYSQL","Retrieve version Mysql","","","","Retrieve version Mysql",""
"passed","Wed Nov 22 02:29:55 GMT 2023","Wed Nov 22 02:29:59 GMT 2023","3697","ALERT_AND_POPUP_DISPLAY","Check different alerts popins are displayed","","","","Check different alerts popins are displayed",""
"skipped","Wed Nov 22 02:26:24 GMT 2023","Wed Nov 22 02:26:24 GMT 2023","1","CONTAINER-MSSQL","Retrieve version MSSQL","","","","Retrieve version MSSQL",""
"unknown","Wed Nov 22 02:35:29 GMT 2023","Wed Nov 22 02:35:32 GMT 2023","2798","WIDGET_INTERACTIONS_WITH_INPUT_FIELDS","Checking a date via date picker using input field","","","","Checking a date via date picker using input field",""
"unknown","Wed Nov 22 02:35:37 GMT 2023","Wed Nov 22 02:35:41 GMT 2023","3664","WIDGET_INTERACTIONS_WITH_INPUT_FIELDS","Change input value by clicking on the slider bar","","","","Change input value by clicking on the slider bar",""
"failed","Wed Nov 22 02:33:39 GMT 2023","Wed Nov 22 02:34:15 GMT 2023","35666","WIDGET_DISPLAY_AND_MENUS","Fill all the select fields displayed","","","","Fill all the select fields displayed",""
"passed","Wed Nov 22 02:30:44 GMT 2023","Wed Nov 22 02:31:02 GMT 2023","18266","CLICK_ON_DIFFERENT_BUTTON_TYPES","Display radio button text when selected","","","","Display radio button text when selected",""
"passed","Wed Nov 22 02:30:23 GMT 2023","Wed Nov 22 02:30:30 GMT 2023","7387","BROWSER_WINDOWS_AND_TABS","Opening a new window with text when clicking on ""New Window Message"" button","","","","Opening a new window with text when clicking on ""New Window Message"" button",""
"passed","Wed Nov 22 02:31:08 GMT 2023","Wed Nov 22 02:31:26 GMT 2023","17760","CLICK_ON_DIFFERENT_BUTTON_TYPES","Check dynamic elements change properties after 5 seconds","","","","Check dynamic elements change properties after 5 seconds",""
"failed","Wed Nov 22 02:31:31 GMT 2023","Wed Nov 22 02:32:07 GMT 2023","35990","FILL_FORMS","Fill a complete form using external json data","","","","Fill a complete form using external json data",""
"passed","Wed Nov 22 02:27:29 GMT 2023","Wed Nov 22 02:27:43 GMT 2023","13241","ACCESS_LINKS","Check API response by clicking on links","","","","Check API response by clicking on links",""
"passed","Wed Nov 22 02:35:50 GMT 2023","Wed Nov 22 02:35:54 GMT 2023","4056","WIDGET_INTERACTIONS_WITH_INPUT_FIELDS","The button ""Reset"" is visible after the progress bar is at 100%","","","","The button ""Reset"" is visible after the progress bar is at 100%",""
"unknown","Wed Nov 22 02:33:20 GMT 2023","Wed Nov 22 02:33:29 GMT 2023","8707","WIDGET_DISPLAY_AND_MENUS","Navigate using in-page tab contents on click","","","","Navigate using in-page tab contents on click",""
"failed","Wed Nov 22 02:27:43 GMT 2023","Wed Nov 22 02:28:13 GMT 2023","30952","ACCESS_LINKS","Check broken links returns an error 500","","","","Check broken links returns an error 500",""
"passed","Wed Nov 22 02:30:07 GMT 2023","Wed Nov 22 02:30:15 GMT 2023","8537","BROWSER_WINDOWS_AND_TABS","Redirection to a new tab when clicking on ""New Tab"" button","","","","Redirection to a new tab when clicking on ""New Tab"" button",""
"passed","Wed Nov 22 02:26:24 GMT 2023","Wed Nov 22 02:26:24 GMT 2023","43","API_CALLS","Search a pet in petstore API","","","","Search a pet in petstore API",""
"passed","Wed Nov 22 02:30:30 GMT 2023","Wed Nov 22 02:30:36 GMT 2023","5557","CLICK_ON_DIFFERENT_BUTTON_TYPES","Display checkbox folders and sub-folders when checked","","","","Display checkbox folders and sub-folders when checked",""
"passed","Wed Nov 22 02:30:03 GMT 2023","Wed Nov 22 02:30:07 GMT 2023","3610","ALERT_AND_POPUP_DISPLAY","Check different modals dialogs popin are displayed","","","","Check different modals dialogs popin are displayed",""
