"Status","Start Time","Stop Time","Duration in ms","Parent Suite","Suite","Sub Suite","Test Class","Test Method","Name","Description"
"unknown","Tue Mar 07 02:57:48 GMT 2023","Tue Mar 07 02:57:48 GMT 2023","1","FRAMES","Check frames nested are displayed properly","","","","Check frames nested are displayed properly",""
"skipped","Tue Mar 07 02:55:01 GMT 2023","Tue Mar 07 02:55:01 GMT 2023","1","CONTAINER-MYSQL","Retrieve version Mysql","","","","Retrieve version Mysql",""
"passed","Tue Mar 07 02:55:45 GMT 2023","Tue Mar 07 02:55:49 GMT 2023","3970","ADD_DELETE_UPDATE_WEBTABLE_DATA","Search Kierra entry in the web table","","","","Search Kierra entry in the web table",""
"passed","Tue Mar 07 02:55:28 GMT 2023","Tue Mar 07 02:55:32 GMT 2023","4222","ACCESS_LINKS","Check broken links returns an error 500","","","","Check broken links returns an error 500",""
"unknown","Tue Mar 07 02:58:03 GMT 2023","Tue Mar 07 02:58:05 GMT 2023","2510","WIDGET_DISPLAY_AND_MENUS","Navigate using in-page tab contents on click","","","","Navigate using in-page tab contents on click",""
"unknown","Tue Mar 07 02:57:48 GMT 2023","Tue Mar 07 02:57:48 GMT 2023","1","FRAMES","Check multiple frames are displayed properly","","","","Check multiple frames are displayed properly",""
"passed","Tue Mar 07 02:56:56 GMT 2023","Tue Mar 07 02:56:59 GMT 2023","3624","CLICK_ON_DIFFERENT_BUTTON_TYPES","Display button click when clicked on","","","","Display button click when clicked on",""
"passed","Tue Mar 07 02:55:52 GMT 2023","Tue Mar 07 02:55:55 GMT 2023","3240","ADD_DELETE_UPDATE_WEBTABLE_DATA","Download a file online","","","","Download a file online",""
"passed","Tue Mar 07 02:55:36 GMT 2023","Tue Mar 07 02:55:41 GMT 2023","4845","ADD_DELETE_UPDATE_WEBTABLE_DATA","Edit the first entry in the web table","","","","Edit the first entry in the web table",""
"passed","Tue Mar 07 02:58:59 GMT 2023","Tue Mar 07 02:59:03 GMT 2023","3829","WIDGET_DISPLAY_AND_MENUS","Display information tooltips on hover for designated element","","","","Display information tooltips on hover for designated element",""
"passed","Tue Mar 07 02:56:59 GMT 2023","Tue Mar 07 02:57:07 GMT 2023","8001","CLICK_ON_DIFFERENT_BUTTON_TYPES","Check dynamic elements change properties after 5 seconds","","","","Check dynamic elements change properties after 5 seconds",""
"passed","Tue Mar 07 02:56:53 GMT 2023","Tue Mar 07 02:56:56 GMT 2023","2836","CLICK_ON_DIFFERENT_BUTTON_TYPES","Display radio button text when selected","","","","Display radio button text when selected",""
"passed","Tue Mar 07 02:59:25 GMT 2023","Tue Mar 07 02:59:29 GMT 2023","3981","WIDGET_INTERACTIONS_WITH_INPUT_FIELDS","The button ""Reset"" is visible after the progress bar is at 100%","","","","The button ""Reset"" is visible after the progress bar is at 100%",""
"skipped","Tue Mar 07 02:55:01 GMT 2023","Tue Mar 07 02:55:01 GMT 2023","2","CONTAINER-MSSQL","Retrieve version MSSQL","","","","Retrieve version MSSQL",""
"passed","Tue Mar 07 02:55:01 GMT 2023","Tue Mar 07 02:55:01 GMT 2023","27","API_CALLS","Rename a pet in petstore API","","","","Rename a pet in petstore API",""
"passed","Tue Mar 07 02:55:32 GMT 2023","Tue Mar 07 02:55:36 GMT 2023","3814","ADD_DELETE_UPDATE_WEBTABLE_DATA","Add a new entry to web table","","","","Add a new entry to web table",""
"passed","Tue Mar 07 02:56:17 GMT 2023","Tue Mar 07 02:56:20 GMT 2023","3176","ALERT_AND_POPUP_DISPLAY","Check different modals dialogs popin are displayed","","","","Check different modals dialogs popin are displayed",""
"passed","Tue Mar 07 02:55:01 GMT 2023","Tue Mar 07 02:55:01 GMT 2023","79","API_CALLS","Create a new pet in petstore API","","","","Create a new pet in petstore API",""
"unknown","Tue Mar 07 02:59:09 GMT 2023","Tue Mar 07 02:59:12 GMT 2023","2570","WIDGET_INTERACTIONS_WITH_INPUT_FIELDS","Checking a date via date picker using calendar module","","","","Checking a date via date picker using calendar module",""
"failed","Tue Mar 07 02:57:12 GMT 2023","Tue Mar 07 02:57:48 GMT 2023","36134","FILL_FORMS","Fill a complete form using external json data","","","","Fill a complete form using external json data",""
"passed","Tue Mar 07 02:56:10 GMT 2023","Tue Mar 07 02:56:13 GMT 2023","3272","ALERT_AND_POPUP_DISPLAY","Check different alerts popins are displayed","","","","Check different alerts popins are displayed",""
"passed","Tue Mar 07 02:56:35 GMT 2023","Tue Mar 07 02:56:42 GMT 2023","7242","BROWSER_WINDOWS_AND_TABS","Opening a new window with text when clicking on ""New Window Message"" button","","","","Opening a new window with text when clicking on ""New Window Message"" button",""
"unknown","Tue Mar 07 02:59:15 GMT 2023","Tue Mar 07 02:59:17 GMT 2023","2561","WIDGET_INTERACTIONS_WITH_INPUT_FIELDS","Change input value by clicking on the slider bar","","","","Change input value by clicking on the slider bar",""
"unknown","Tue Mar 07 02:59:12 GMT 2023","Tue Mar 07 02:59:15 GMT 2023","2815","WIDGET_INTERACTIONS_WITH_INPUT_FIELDS","Change input value by moving the slider","","","","Change input value by moving the slider",""
"passed","Tue Mar 07 02:59:17 GMT 2023","Tue Mar 07 02:59:21 GMT 2023","3624","WIDGET_INTERACTIONS_WITH_INPUT_FIELDS","Click on ""Start"" to fill up the progress bar","","","","Click on ""Start"" to fill up the progress bar",""
"passed","Tue Mar 07 02:59:21 GMT 2023","Tue Mar 07 02:59:25 GMT 2023","3670","WIDGET_INTERACTIONS_WITH_INPUT_FIELDS","Click on ""Stop"" to stop the progress bar from filling","","","","Click on ""Stop"" to stop the progress bar from filling",""
"passed","Tue Mar 07 02:55:01 GMT 2023","Tue Mar 07 02:55:04 GMT 2023","2982","ACCESS_LINKS","Redirection to a new page when clicking on link (tabs and windows)","","","","Redirection to a new page when clicking on link (tabs and windows)",""
"failed","Tue Mar 07 02:58:10 GMT 2023","Tue Mar 07 02:58:47 GMT 2023","36784","WIDGET_DISPLAY_AND_MENUS","Fill all the select fields displayed","","","","Fill all the select fields displayed",""
"passed","Tue Mar 07 02:55:49 GMT 2023","Tue Mar 07 02:55:52 GMT 2023","2971","ADD_DELETE_UPDATE_WEBTABLE_DATA","Upload a file and check file path","","","","Upload a file and check file path",""
"passed","Tue Mar 07 02:56:20 GMT 2023","Tue Mar 07 02:56:28 GMT 2023","7914","BROWSER_WINDOWS_AND_TABS","Redirection to a new tab when clicking on ""New Tab"" button","","","","Redirection to a new tab when clicking on ""New Tab"" button",""
"passed","Tue Mar 07 02:55:01 GMT 2023","Tue Mar 07 02:55:01 GMT 2023","41","API_CALLS","Search a pet in petstore API","","","","Search a pet in petstore API",""
"unknown","Tue Mar 07 02:59:07 GMT 2023","Tue Mar 07 02:59:09 GMT 2023","2922","WIDGET_INTERACTIONS_WITH_INPUT_FIELDS","Checking a date via date picker using input field","","","","Checking a date via date picker using input field",""
"passed","Tue Mar 07 02:56:28 GMT 2023","Tue Mar 07 02:56:35 GMT 2023","7083","BROWSER_WINDOWS_AND_TABS","Redirection to a new window when clicking on ""New Window"" button","","","","Redirection to a new window when clicking on ""New Window"" button",""
"unknown","Tue Mar 07 02:57:53 GMT 2023","Tue Mar 07 02:57:55 GMT 2023","2605","WIDGET_DISPLAY_AND_MENUS","Open only the selected accordian section on click","","","","Open only the selected accordian section on click",""
"passed","Tue Mar 07 02:55:24 GMT 2023","Tue Mar 07 02:55:28 GMT 2023","3489","ACCESS_LINKS","Check API response by clicking on links","","","","Check API response by clicking on links",""
"passed","Tue Mar 07 02:55:01 GMT 2023","Tue Mar 07 02:55:01 GMT 2023","68","API_CALLS","Delete a pet in petstore API","","","","Delete a pet in petstore API",""
"passed","Tue Mar 07 02:59:03 GMT 2023","Tue Mar 07 02:59:07 GMT 2023","3635","WIDGET_INTERACTIONS_WITH_INPUT_FIELDS","Check suggestions when using autocomplete on input field","","","","Check suggestions when using autocomplete on input field",""
"passed","Tue Mar 07 02:55:41 GMT 2023","Tue Mar 07 02:55:45 GMT 2023","4022","ADD_DELETE_UPDATE_WEBTABLE_DATA","Delete the third entry in the web table","","","","Delete the third entry in the web table",""
"passed","Tue Mar 07 02:57:07 GMT 2023","Tue Mar 07 02:57:12 GMT 2023","4369","DRAG_AND_DROP","Drag and drop a draggable element into another","","","","Drag and drop a draggable element into another",""
"passed","Tue Mar 07 02:58:05 GMT 2023","Tue Mar 07 02:58:10 GMT 2023","4761","WIDGET_DISPLAY_AND_MENUS","Navigate using in-page menu and sub-menu contents on hover","","","","Navigate using in-page menu and sub-menu contents on hover",""
"passed","Tue Mar 07 02:56:42 GMT 2023","Tue Mar 07 02:56:47 GMT 2023","4671","CLICK_ON_DIFFERENT_BUTTON_TYPES","Display checkbox folders and sub-folders when checked","","","","Display checkbox folders and sub-folders when checked",""
